<?xml version="1.0" encoding="UTF-8" standalone="no" ?>
<!DOCTYPE document_schema SYSTEM "document_schema.dtd">

<document_schema>
<Workspace Author="Teddy DIDE" 
           Brief="Word Interpreter generated by gensources."
           Name="wordxml_interpreter"
           Option="0"
           Type="Project"
           Version="1.00">
    <File Name="WordXMLDocument" Alias="WordXML">
      <Entity Class="Data" Name="WordXMLDocument" Alias="WordXML"/>
      <Entity Class="Function" Name="WordXMLDocument:initialize@void">
        <Attribute Name="WordXMLDocument" Alias="WordXML"/>
      </Entity>
      <Entity Class="Function" Name="WordXMLDocument:terminate@void">
        <Attribute Name="WordXMLDocument" Alias="WordXML"/>
      </Entity>
      
      <Content Type="Example" Target="WordXMLDocument:initialize@void">
xml = new WordXML();
xml.Initialize();
      </Content>  
      
      <Content Type="Example" Target="WordXMLDocument:terminate@void">
xml.Terminate();
xml = null;
      </Content>  

    </File>
</Workspace>
</document_schema>
