<?xml version="1.0" encoding="UTF-8" standalone="no" ?>
<!DOCTYPE document_schema SYSTEM "document_schema.dtd">

<document_schema>
  <Workspace Author="Teddy DIDE" 
             Brief="cppBase generated by gensources."
             Name="cppBase"
			 Option="0" 
			 Type="Project" 
			 Version="1.00">
		 
    <File Name="cppInheritance">
      <Entity Name="cppInheritance">
         <Attribute Name="idDerived" Alias="derived"/>
      </Entity>
    </File>
	
    <File Name="cppFunction">
      <Entity Name="cppFunction">
         <Attribute Name="idDecFile" Alias="cppDeclarationFile"/>
         <Attribute Name="idDefFile" Alias="cppDefinitionFile"/>
      </Entity>
      <Relation Name="FK_FUNCTION_DEC_FILE" Alias="cppDeclarationFunction"/>
      <Relation Name="FK_FUNCTION_DEF_FILE" Alias="cppDefinitionFunction"/>
    </File>
    
    <File Name="cppClass">
      <Entity Name="cppClass">
         <Attribute Name="idEncapsulationClass" Alias="encapsulationClass"/>
      </Entity>
      <Relation Name="FK_CLASS_CLASS" Alias="internClasse"/>
    </File>
    
    <File Name="debugTypeInfo">
      <Entity Name="debugTypeInfo">
         <Attribute Name="idPrimitiveType" Alias="primitiveType"/>
      </Entity>
      <Relation Name="FK_DEBUGTYPE_DEBUGTYPE" Alias="richType"/>
    </File>
  </Workspace>
</document_schema>
