<?xml version="1.0" encoding="UTF-8" standalone="no" ?>
<!DOCTYPE document_schema SYSTEM "document_schema.dtd">
<document_schema>

  <Workspace Author="Teddy DIDE" Brief="Word Interpreter generated by gensources." Name="wordxml_interpreter" Option="0" Type="Project" Version="1.00">
    <File Alias="WordXML" Name="WordXMLDocument">
      <Entity Alias="WordXML" Class="Data" Name="WordXMLDocument">
        <Comments> Classe permettant d'initialiser ou libérer les objets XML.</Comments>
        <Attribute Modifier="Id Const " Name="Id" Type="UInt64"/>
      </Entity>
      <Entity Class="Function" FunctionName="initialize" Name="WordXMLDocument:initialize@void">
        <Comments> Initialise le parseur XML.</Comments>
        <Attribute Alias="WordXML" Modifier="Ref Const Contextual Static " Name="WordXMLDocument" Type="UInt64"/>
        <Attribute Modifier="Id Const " Name="Id" Type="UInt64"/>
      </Entity>
      <Entity Class="Function" FunctionName="terminate" Name="WordXMLDocument:terminate@void">
        <Comments> Libère les objets XML.</Comments>
        <Attribute Alias="WordXML" Modifier="Ref Const Contextual Static " Name="WordXMLDocument" Type="UInt64"/>
        <Attribute Modifier="Id Const " Name="Id" Type="UInt64"/>
      </Entity>
      <Relation Multiplicity="Zero-One" Name="R_WordXMLDocument:initialize@void_WordXMLDocument" Source="WordXMLDocument" SourceREF="Id" Target="WordXMLDocument:initialize@void" TargetREF="WordXMLDocument"/>
      <Relation Multiplicity="Zero-One" Name="R_WordXMLDocument:terminate@void_WordXMLDocument" Source="WordXMLDocument" SourceREF="Id" Target="WordXMLDocument:terminate@void" TargetREF="WordXMLDocument"/>
      <Content Target="WordXMLDocument:initialize@void" Type="Example">
xml = new WordXML();
xml.Initialize();
      </Content>
      <Content Target="WordXMLDocument:terminate@void" Type="Example">
xml.Terminate();
xml = null;
      </Content>
    </File>
    <File Name="libword">
      <Entity Class="Package" Name="libword">
        <Attribute Modifier="Id Const " Name="Id" Type="UInt64"/>
      </Entity>
      <Relation Multiplicity="Zero-One" Name="R_libword_WordXMLDocument" Source="WordXMLDocument" SourceREF="Id" Target="libword" TargetREF="Id"/>
    </File>
  </Workspace>

</document_schema>
